{
  "attemptId": "attempt-globus-compute-002",
  "runId": "run-7f3e2a",
  "externalSystem": {
    "type": "globus_compute",
    "endpoint": "https://compute.api.globus.org/v3"
  },
  "externalTaskId": "gc-task-5c2f8e1a-77aa-4b0e-9d3c-2f1e8a7b6c5d",
  "status": "submitted",
  "supersedesAttemptId": "attempt-globus-compute-001",
  "idempotencyKey": "idem-7a8b9c",
  "createdAt": "2026-10-01T16:12:40Z"
}
