{
  "attemptId": "attempt-globus-compute-001",
  "runId": "run-7f3e2a",
  "externalSystem": {
    "type": "globus_compute",
    "endpoint": "https://compute.api.globus.org/v3"
  },
  "externalTaskId": "gc-task-5c2f8e1a-77aa-4b0e-9d3c-2f1e8a7b6c5d",
  "status": "running",
  "lastReconciledAt": "2026-10-01T15:04:05Z",
  "idempotencyKey": "idem-4d5e6f",
  "createdAt": "2026-10-01T14:58:11Z"
}
